{"file":"/Users/rmanaloto/dev/github/ray-manaloto/dotfiles/.claude/worktrees/codex-takeover/docs/research/saved-searches/codex-takeover-2026-10-05.toml","generated_at":"2026-10-05T12:11:00.707114+00:00","watches":[{"id":"code-any-repo-openai-codex-project-doc-fallback-f-d610afc0","kind":"code","query":"repo:openai/codex project_doc_fallback_filenames","repo":null,"status":"ok","count":8,"urls":["https://github.com/openai/codex/blob/HEAD/codex-rs/core/src/agents_md.rs","https://github.com/openai/codex/blob/HEAD/codex-rs/config/src/config_toml.rs","https://github.com/openai/codex/blob/HEAD/codex-rs/config/defaults.toml","https://github.com/openai/codex/blob/HEAD/codex-rs/core/src/config/mod.rs","https://github.com/openai/codex/blob/HEAD/codex-rs/thread-manager-sample/src/main.rs","https://github.com/openai/codex/blob/HEAD/codex-rs/core/config.schema.json","https://github.com/openai/codex/blob/HEAD/codex-rs/core/src/agents_md_tests.rs","https://github.com/openai/codex/blob/HEAD/codex-rs/core/tests/suite/agents_md.rs"],"confirmed":null,"reason":null,"complete":true},{"id":"code-any-repo-openai-codex-filename-readme-md-cod-7529d76f","kind":"code","query":"repo:openai/codex filename:README.md Codex","repo":null,"status":"ok","count":51,"urls":["https://github.com/openai/codex/blob/HEAD/codex-rs/codex-api/README.md","https://github.com/openai/codex/blob/HEAD/codex-rs/codex-client/README.md","https://github.com/openai/codex/blob/HEAD/scripts/codex_package/README.md","https://github.com/openai/codex/blob/HEAD/codex-rs/README.md","https://github.com/openai/codex/blob/HEAD/codex-rs/core/README.md","https://github.com/openai/codex/blob/HEAD/codex-rs/otel/README.md","https://github.com/openai/codex/blob/HEAD/codex-rs/tools/README.md","https://github.com/openai/codex/blob/HEAD/codex-rs/mermaid/README.md","https://github.com/openai/codex/blob/HEAD/codex-rs/chatgpt/README.md","https://github.com/openai/codex/blob/HEAD/codex-rs/protocol/README.md"],"confirmed":null,"reason":null},{"id":"code-any-repo-anthropics-claude-code-instructionf-ed0d77c4","kind":"code","query":"repo:anthropics/claude-code instructionFiles","repo":null,"status":"ok","count":7,"urls":["https://github.com/anthropics/claude-code/blob/HEAD/mods/agents-md/README.md","https://github.com/anthropics/claude-code/blob/HEAD/mods/agents-md/hooks/register.ts","https://github.com/anthropics/claude-code/blob/HEAD/mods/agents-md/hooks/modes/mode-of.ts","https://github.com/anthropics/claude-code/blob/HEAD/mods/agents-md/hooks/modes/types/mode/mode.ts","https://github.com/anthropics/claude-code/blob/HEAD/mods/agents-md/hooks/hooks.json","https://github.com/anthropics/claude-code/blob/HEAD/mods/agents-md/.claude-plugin/plugin.json","https://github.com/anthropics/claude-code/blob/HEAD/mods/agents-md/tests/register.test.ts"],"confirmed":null,"reason":null,"complete":true},{"id":"code-any-repo-anthropics-claude-code-filename-rea-77bb5924","kind":"code","query":"repo:anthropics/claude-code filename:README.md Claude","repo":null,"status":"ok","count":29,"urls":["https://github.com/anthropics/claude-code/blob/HEAD/plugins/claude-opus-4-5-migration/README.md","https://github.com/anthropics/claude-code/blob/HEAD/README.md","https://github.com/anthropics/claude-code/blob/HEAD/mods/README.md","https://github.com/anthropics/claude-code/blob/HEAD/plugins/README.md","https://github.com/anthropics/claude-code/blob/HEAD/mods/diff/README.md","https://github.com/anthropics/claude-code/blob/HEAD/examples/mdm/README.md","https://github.com/anthropics/claude-code/blob/HEAD/mods/agents-md/README.md","https://github.com/anthropics/claude-code/blob/HEAD/plugins/hookify/README.md","https://github.com/anthropics/claude-code/blob/HEAD/examples/settings/README.md","https://github.com/anthropics/claude-code/blob/HEAD/plugins/plugin-dev/README.md"],"confirmed":null,"reason":null},{"id":"issues-anthropics-claude-code-agents-md-instructionfiles-claude-code-c-e06449c0","kind":"issues","query":"AGENTS.md instructionFiles Claude Code Codex discovery","repo":"anthropics/claude-code","status":"ok","count":1,"urls":["https://github.com/anthropics/claude-code/issues/6235"],"confirmed":null,"reason":null},{"id":"discussions-anthropics-claude-code-agents-md-instructionfiles-claude-co-174b80b6","kind":"discussions","query":"AGENTS.md instructionFiles Claude Code Codex discovery","repo":"anthropics/claude-code","status":"empty-unarmed","count":0,"urls":[],"confirmed":null,"reason":"fan-out did not verify this search"},{"id":"releases-anthropics-claude-code-agents-md-instructionfiles-claude-code-2b5c4c3b","kind":"releases","query":"AGENTS.md instructionFiles Claude Code Codex discovery","repo":"anthropics/claude-code","status":"empty-verified","count":0,"urls":[],"confirmed":null,"reason":null}],"controls":[{"role":"health","query":"repo:cli/cli filename:README.md","count":9,"rc":0,"status":"ok"},{"role":"known-absent","query":"\"zzc511659a63f9\" repo:openai/codex","count":0,"rc":0,"status":"ok"},{"role":"known-absent","query":"\"zz6977c0979681\" repo:anthropics/claude-code","count":0,"rc":0,"status":"ok"},{"role":"must-hit","query":"repo:openai/codex filename:README.md Codex","count":51,"rc":0,"status":"ok"},{"role":"must-hit","query":"repo:anthropics/claude-code filename:README.md Claude","count":29,"rc":0,"status":"ok"}]}